{
  "version": "devflow.gateEvidence.v1",
  "workItemId": "task-001",
  "gateId": "test",
  "command": [
    "npm",
    "test"
  ],
  "startedAt": "2026-05-16T09:20:00.000Z",
  "finishedAt": "2026-05-16T09:20:00.000Z",
  "exitCode": 0,
  "status": "unknown",
  "stdoutSummary": "No full npm test output was recorded in the interrupted snapshot.",
  "stderrSummary": "",
  "relevance": {
    "changedFilesCovered": [
      "packages/cli/src/index.js",
      "packages/cli/test/status-json.test.mjs"
    ],
    "reason": "The required configured gate is relevant to the edited CLI status behavior, but this fixture records the gate as unknown because the full gate output is absent."
  },
  "remainingRisk": [
    "Focused JSON status coverage was observed separately, but this required gate evidence is not confirmed in the snapshot."
  ]
}
